reviewId,userName,content,score,at
6ed4ab3e-2981-49e4-97cc-6a5729e3c676,Raudatus Syifa,"Sangat berguna buat masuk ke situs yang susah di akses atau suka error.iklan nya juga gak terasa banyak banget, tiap kali main paling cuman ada 2-3 iklan yang muncul.durasi iklannya juga kerasa wajar,jadi intinya ini tuh aplikasi yang bagus((o(*>Ï‰<*)o))",5,2024-03-20 16:39:28
e1c97b58-99db-4ef1-a859-d245cdad6ef6,Kadek Eka,"Apk sampah jaringannya lemot terus iklan dimana mana, iya dimaklumi kok ada iklan tapi yoo jaringannya astaghh susah banget buat nonton live streaming aja cuma dapat kualitas mentok di 240p itupun kebanyakan mutar"" nya bahkan untuk kualitas 144p aja masih suka loading, dibandingkan dengan apk vpn lainnya yg wow luar biasa di pake nonton banget bisa tembus di 1080p lancar banget gak ada tuh masalah jaringan mutar"", nyesel banget download aplikasi vpn ini, sangat sangat tidak di rekomendasi",1,2024-03-17 20:26:21
e4b9e6bc-c4b6-48e8-a189-014b1110b209,Wira Zizo Gladi,"Kenapa dia gak hilang dari status bar ya?? Mana tulisannya gak enak lagi *Terjadi kesalahan perangkat ketuk untuk menyambung kembali* disuruh nyambung, iklan, matikan, iklan dan balik lihat status bar masih aja suruh nyambung lagi dan iklannya rajin banget, untuk keuntungan pembikinnya.",1,2024-02-24 18:21:40
56a0ddfd-888f-4d81-9853-9b25ee0d27d7,Jaja Subagja,Bintang5pasti dong selama Saya menggunakan VPN turbo Sangat memuaskan recommended banget buat kalian2 yang butuh aplikasi VPN ya VPN turbo best lah dan sampai skrg msh terbaik mudah dan ga sulit terus jaga dan tingkatkan pengalaman sampai skrng makin baik coba kalian buktikan lalu bedakan dngn yg lain,5,2024-03-20 01:37:41
eb757111-0478-43f8-9bc8-6c1625133d3e,TIm Balu,"Masalah nya suka putus2 sendiri VPN nya..!!20 menit jalan bagus, tiba2 minta ganti lokasi lagi. Harus di ganti lagi lokasi atau perbaiki. Jadi untuk sementara Saya kasih 1 bintang saja dulu, nanti kalau sudah tidak lagi seperti begitu, baru Saya kasih 5 bintang..!!",1,2024-03-04 06:43:44
6eacf8f9-5162-400c-ba55-18f98893d6b3,Ari Anta,"Maff saya buang bintang nya.. Dan harus saya delete .. Karna sanga membuat saya kesal... Tiba2 koneksi nya di non aktif kan.. Kalau setengah membuat apk, lebih baik ga usah buat apk kayak gini... ðŸ˜¡ðŸ¤¬ðŸ¤¬ðŸ¤¬ðŸ¤¬ðŸ¤¬",1,2024-03-03 00:58:10
3dd01b4d-b6e8-4f2e-9076-b5e739c5008d,Chimuts Muts,Bagus bagus sih TPI MSI butuh di agret. Sya brikn 4 bntng dlu soal nya MSI banyak lgi yg harus diperbaiki. Sprti terputus nya koneksi dan msih agak lambat. Iklan trllu banyak.,4,2024-03-02 02:02:20
cc1b67b1-ea8f-4d4d-b668-7ab1c366de7a,Irwan septiawan Theaa,"Sangat membantu membuka link yang d blok. Sukses terus buat apk nya,,sekarang gbsa download d situs,,!! Saya kurangin 1,,nnti klo sudah bsa download lg sya tmbh lg bntangnya. Trims",4,2024-02-25 03:31:38
6c16b9bc-6f0b-4b2f-bb42-47e137de7363,Aska Alhakim,Sangat bagus cocok untuk main game tapi tolong di perbaiki lagi karena kadang putus sendri mohon di perbaiki terimakasih,5,2024-03-20 17:42:09
75185cbe-08b8-4a49-bb4d-4e7aa2eec60b,AJI SANTOSA{31},"Saya berkomentar tentang, vpn ini, sejak saya MTs hingga saat ini vpn ini memang yang terbaik buat ++ juga bisa, dari tahun 2015 an saya pakai ini turbo vpn bagiku ini keren dan jika pengin luas pakai yang premium dan berlangganan, tapi saya memilih tidakðŸ˜…, walaupun ada uji coba pokoknya keren untuk turbo vpn dan makasihðŸ˜…",5,2024-01-28 17:24:58
f5447d5c-23fc-4447-a383-9b8d557663d9,Climiz '69,"Koneksi cepat dan tanpa ribet.. Masalah iklan itu wajar, namanya juga gratis, kalau mau tanpa iklan ya harus bayar... Terimakasih banyak untuk aplikasinya boss... Sukses terus...",5,2024-02-11 21:44:14
9fc15f57-3bd0-4952-a55d-b591301ffdcf,jua saja20,"sangat menyenangkan web.situs semua yg tadi nya ga bisa di jangkau, sekarang sudah bisa, karna aku memakai aplikasi ini, kuharap perkembangan atau update buat selanjutnya di aplikasi ini, lebih bagus dan memudahkan untuk semua yg memakai nya. terus semangat kawan kerja ðŸ˜ƒ jangan putus asa kecil hati, yg disebabkan dari mulut mulut yg tdak pantas di dngar, maupun dari orngÂ² yg tidak kenal atau yg kenal, bahkan dri lingkungan sekitar anda, anda sendiri lah yg bisa nilai mna yg baik mulutnya",5,2024-02-12 11:10:17
e37e62b7-58cc-47cc-a208-daa0b24bb106,Sawa Danaraja,"Nah ini sangat bagusðŸ‘ karena bisa otomatis pilih lokasi peramban dan juga bisa full durasi nya, kalau vpn biasa itu maksimal 1 jam",5,2024-01-12 01:08:15
4fa40e06-d0ee-42eb-9d79-fa7ae48ae800,Hangesa Eca,"Sangat bagus,dari segi lancarnya kenceng tapi ada suatu masalah kadang iklan nya yang tiba tiba bikin eror,kalo kedepannya bisa diperbaiki saya kasih bintang lima",4,2024-02-19 18:43:02
e373c50c-55df-40a0-a4c2-1a49576fd518,Heri Suseno,"Saya tidak pernah berlangganan di aplikasi ini kenapa tiba tiba saldo dana saya kepotong,sudah itu no minalnya besar saya minta aplikasi ini bisa mengembalikan saldo dana saya yang berlangganan tidak sah.",1,2024-01-28 00:44:33
e8e21779-f2e3-4996-8439-7c9ee18b5382,Sanny Machal,"sangat bagus, tapi kalau bisa tolong iklan nya dikurangi, karena sangat meganggu, lebih ditingkatkan lagi dan sukses,terimakasih.",4,2024-01-29 02:10:04
9c1ef650-4674-46cd-a153-495c9b9db28b,Zahrial Zhali,baik dan lancar.. semoga bisa ditambah dg fitur terjemahan sesuai keinginan negara pengguna / pengupload video... bokep barat nya di subtitle / diterjemahkan donk....,5,2024-01-14 04:39:06
ed9e952c-71f7-4567-bcd9-7be94aec73e4,Virly Abs,"Semoga, dengan menggunakan Aplikasi Turbo Vpn dapat membantu saya untuk browsing dan selalu terjaga di setiap website yang saya kunjungi. Amin. Sukses selalu Turbo VPN & Turbo VPN Lite",5,2024-02-01 01:04:07
cda80efd-7943-482b-aa42-f1967c8abfe3,Saripah Ipa,"Setelah saya lebih teliti dan baca dengan benar ternyata aplikasi ini mengumpulkan banyak data dari pengguna apk ini, dan memberikannya kepada pihak ketiga,jadi teman teman kita harus bijak dalam menggunakan apk jangan langsung download sajaðŸ˜",2,2024-01-04 00:34:34
006d016a-aa17-4c49-b248-35d11e89eb8a,Sinyo Ganteng,"Sudah lama menggunaka VPN ini. Akan tetapi makin kesini makin kebanyakan iklan. Bukan masalah iklannya, tapi setiap muncul iklan membuat koneksi terputus. Mungkin perlu dikoreksi untuk penempatan atau memunculkan iklan tsb. Terimakasih.",2,2023-10-24 23:22:31
cb1a4668-f3bf-4960-adec-eff171244c7e,Iwan 123,Aplikasi nya lumayan bagus sangat membantu walaupun tiba tiba jaringan nya sedikit lelet tapi sangat membantu jadi saya kasih bintang 4 dulu,4,2024-03-01 22:51:53
87f19d6f-0be1-4456-8806-c132446d6fdc,Gagal Tobat,"Sudah bagus,tapi tolong di optimalkan lagi agar tidak menjadi terlalu berat saat membuka browser.",5,2024-03-14 00:11:57
c34f884a-1d93-4f62-a85a-215ee9cbc01c,Rich Arka,"Dengan aplikasi ini, saya bisa membuka dan mengunjungi website kesukaan saya... X... Twitter... Untuk lihat dan donwload video... Motivasi di pagi hari dan p... Pembelajaran biologi. Sangat direkomendasi 5/5.",5,2024-02-02 20:09:31
fbcd7c53-ce4f-47a1-9521-dfdbd6b77781,Om Bray,Kalau sekarang aplikasi ini belum bisa saya buka untuk melihat apa isi yg terbaik di dalam nya. Untuk sementara dgn rasa sedikit kecewa saya beri Bintang 2 dulu,2,2024-03-01 10:35:26
1c678d60-932e-45e5-bbee-09115b836142,Fdenthe VansZz,"Sangat membantu saya membuka suatu link untuk download dan upload file yang terbatas pada sistem websitenya.. Sayangnya Iklannya banyak, kalau ingin tidak ada iklannya.. Saya harus dikenakan biaya Per/bulan.. Saran dari saya jika pengguna baru download situs Turbo VPN bebas iklan.. Jika bagi pengguna situs ini, lebih dari sebulan tidak merasa keberatan ada iklannya.. karena saya download Turbo VPN sudah dikenakan biaya. Semoga semakin banyak menggunakan Turbo VPN tanpa iklan.. #FNXedwsâ„¢",5,2024-01-05 02:59:03
434379a7-7f09-47ba-92b7-5881de6e202b,Atik Jazimah,"Entah mengapa sekarang vpn ini berjalan dengan loading secepat siput, tidak bukan di app tapi di browser seperti Google,aku sangat stress, tolong benarkan ini plz",2,2024-02-15 22:33:27
f85edc83-4bdf-44e0-8449-aabb74341310,Ahmad Yani,"Aplikasi VPN ini yang paling bagus menurut saya, browsing internet lancar dan download juga cepat. Two thumbs up for Turbo VPN.",5,2024-03-12 12:24:32
f88784cc-76d2-425d-a220-51a4b0387f5d,Andy Saputra123,Turbo vpn parah koneksin cuma sebentar kuawalahan bulak balik buka jaringan VPN. Mohon untuk yg punya appk ini tolong di perbaiki lagi supaya pengguna VPN lebih nyaman,1,2024-01-18 16:31:30
8860a5de-14c7-4480-8c5f-d06b89d945d8,Noval Hamdi,terkadang lemot terkadang cepat dan banyak iklan tapi untuk yang makai gratis dan tidak berlangganan seperti saya itu cukup bagus,4,2024-02-23 21:23:01
64cbc8fe-713b-42f5-9818-14d77894ab5a,Rawan Rawan,Sangat memuaskan dan anti lemotmantap donlot aplikasi ini kawan semuanya di jamin mantap dan tinggal ketik apa yang kalian mau langsung muncul mantapppp okeh kawan trimakasih,5,2024-02-25 07:58:00
5ecb97c7-b655-441f-9cf1-12aac07db97f,zona rc qd pemula,"Aplikasi yang bagus, sangat membantu. Tapi iklan nya sangat banyak saat membuka aplikasi lain",5,2024-03-15 08:14:02
87637183-c0af-4771-bbd2-33956a6d5d90,Agus Ground,Aplikasi ini berjalan sendiri tanpa stock browser dan bisa di atur aplikasi apa saja yang membutuhkan VPN atau tidak tapi bisa mencakup semua aplikasi yang berhubungan dengan internet terutama semua jenis browser. Mode gratis pun cepat tanpa kendala palagi yang paid. VPN ini cocok bagi kaum pemersatu bangsa. Caranya mudah dan simpel tinggal klik sekali hingga muncul server negara maka kalian tinggal masuk browser yang kalian suka. Iklan hanya muncul saat VPN dimatikan. Have a nice private time.,5,2023-10-11 00:07:09
86a77183-578e-4a64-bdb6-9c42b82b9d86,Arys Arwi,"Sangat membantu,, walaupun ada sedikit iklan yg mengganggu. Ya kalau tidak mau ada iklan harus berbayar. Tapi saya suka dengan aplikasi ini. Bisa di gunakan walaupun gratisan, tapi harus melihat iklan untuk bayarannya. Wkwkwk",5,2024-01-05 21:25:14
e882cc29-830d-487d-93b3-1140f5e34a2a,Val Rizki,"Sumpah ni aplikasi kebanyakan IKLAN Di nyalain muncul iklan, mau matiin juga iklan mulu. Mana iklanya lama lama bgt",1,2024-02-27 23:04:05
306a0de3-c31b-4fb7-b7ce-4cb3615cfa91,fatimah agustina,"Alhamdulillah udah berapa kali make jaringannya cepat dapat,juga sangat membantu membuka link yang ga bisa terbuka. Makasih â˜ºï¸ðŸ™ðŸ»",5,2024-03-22 11:01:49
1048bbea-876c-4da0-9a36-b1a1058861ec,Jozua Bawinto,Pokoknya bagus sesuai fungsinya tidak sia sia kalian mau download ini apk pendukung ini sangat baik meski banyak iklan tapi bagusssss lahhh,5,2024-01-09 03:13:31
b2e3b3c1-4f77-4c4a-b0d8-dceb9d70a2c6,Tiara Lestari,"Aplikasi yang bagus membantu saya membuka link,download dan upload file sangat lancar,saya beri lima bintang untuk aplikasi turbo VPN,mantap.",5,2024-03-18 00:51:39
f6409216-4aaf-4bb7-80ac-1f7f5616970d,Asma Sahara,"Sangat membantu, tapi juga merusak jaringan, atau memperlambat perangkat. Mohon tingkatkan lagi server nya. Makasih",5,2024-02-15 00:55:35
72a8185c-8b9c-4530-bd5c-1d5d77e55966,Achie Chy,Sinyal hilang hilang terus..baru beberapa detik nyala langsung hilang!,1,2024-03-21 14:55:31
283f7d97-ebe7-4aaf-84f1-de4d9c43200b,Ribib Ini,Lumayan buka situs bokep jd lebih mudah ... Cuma buka situs slot aja yg rungkad terus,5,2024-03-18 23:01:21
07f9e4dc-2d5f-443a-90ca-de64986d5e25,Andre Rahman,Aplikasi ya sangat bagus koneksi ya pun cepat bisa mengakses semua video,5,2024-03-23 01:14:20
18e962c8-9baa-410f-a609-658aa9bac70c,amin Uden045,Sangat bagus dan cepat tapi iklan ya di kurangi,5,2024-03-21 04:01:33
4ec78a42-2b2b-4c4a-8d2d-2b1e641ceb49,Muhamad Arta,aplikasi bagus super cepat pokoya puas baru uji coba mudah2han tambah bagus haya bintang yg bicara,5,2024-03-23 01:18:53
5f9919cb-7b04-47fd-baca-3854559201eb,Haryanto yanto,"Mantaaab,dan tolong diperbaiki jaringannya.awal awalannya kencang namun selang beberapa waktu berjalan mendadak lemot jaringannya",5,2024-02-01 18:37:55
d4f28663-5b3e-47b0-844d-37fdf3e87f9c,hendry7206 Family,"Jaringan gak setabil setelah aku koreksi gak ada pengaruh peningkatan koneksi internet,maaf ya kaya secem.cuman bisa buka blokiran situs .",2,2024-02-02 21:15:41
630cadee-a562-49fa-bbeb-4557b0c06e8b,Refile Azah,Ok...Aplikasi yg sangat bgus utk penguat daya jelajah di server yg sulit utk ditembus memang mantap,5,2024-02-29 01:20:23
4a69e0d0-6581-446a-b154-7c632d2e0fba,Rahmat Naufal,Turbo vpn sangat membantu untuk membuka link yang terbatas dan meski iklan nya agak ganggu tapi itu bukan masalah,5,2024-01-12 10:27:07
407862af-61aa-4dd7-83bd-3ba865bdad7c,Ajo A'one (Joy),"Good application Turbo VPN.,ðŸ‘ðŸ‘ðŸ‘Œ Bikin semua akses ke jaringan favorit jadi lancar dan aman Top bgt gan",5,2024-01-21 02:03:25
7fe466bf-cc3c-4cea-8d22-60391120b370,Ni ketut Surni,Log in bisa ke roblox tapi kenapa saya tidak bisa masuk game wah apa apaan selalu disconnected,1,2024-03-17 09:29:27
55190f1d-7c20-4fec-9b6b-60e10a7e5eeb,Dharma Yudha,"aplikasi bagus , cuma terlaku banyak iklan dan iklannya terlalu panjang dan membosan kn",5,2024-01-29 13:08:33
9e871592-9d2d-4b92-9def-2574f3854cf6,GustyAgung Yoga,"Ya sangat membantu ,masalah iklan tidak begitu jadi soal krn gratis juga. Sy suka apk ini",5,2024-01-16 10:35:56
1082c67a-607e-4fe3-843f-90fe0e94e040,Deri Rie,"Bagus Dan Cepat,,, tapi sayang banyak Iklan,, tolong d Kurangi iklan nya terimakasih",5,2024-02-05 10:53:52
bcdd6976-74ae-4d72-a117-6533be40f2d1,Epic BluePurple,"Banyak iklan yang tidak pantas, mungkin jaringan saya teralihkan ke negara lain. Ada cara untuk mengubah nya? Thanks",5,2024-01-31 10:44:45
6d098704-2371-45a6-a7db-8d138e74184c,Junior P. Siahaan,Agar di tingkatkan lagi kecepatan dan akurasi nya..untuk kenyamanan pengguna dpt lbh banyak menikmati situs2 lain...,5,2024-02-25 23:06:09
527a261d-da7d-4dc7-8b7d-ef120af2158d,Ifan Almer,Iklan oh Iklan * Tanpa iklan sangat membantu dalam pencarian. Finally Vpn best bgt,5,2024-03-12 21:45:00
14b3dec5-d4d7-46c7-9fac-d726b90ab63a,Annisa Vanaya,Sangat membantu saya saat membuka file terblokir dengan vpn ini semua menjadi mudah & lancar.tank too vpn turbo,5,2024-02-04 00:43:17
3dae24be-229c-4d89-bea1-ef8fb18e1cfa,Andyliantus Ajailine,"Cukup lumayan cepat,saya suka pakai turbo vpn,karena bisa download berbagai video,tidak rugi dowload aplikasi yg satu ini",5,2024-02-18 23:02:08
936fab1a-1e7a-4811-8f77-cfd9a0e357a7,khof soh,Aplikasi ini lumayan bagus tapi masih kadang suka lambat/lemah jaringan tlng di benerin lagi ya,4,2024-01-24 01:34:16
7b6065ba-676d-4682-8e99-209d6f9b0e5d,sunandar robi,"Aplikasi yang cepat dan efisien, pekara iklan itu sudah wajar, selebih nya oke",5,2024-02-29 21:01:51
c68a74c2-026b-4e33-afad-5de01bd1b400,Ratna Permata Sari,"Bagus untuk internetan saat transit di Bandara China, kalau ga pakai VPN ga bisa internetnya",5,2024-02-24 04:44:24
4d36cbce-f0aa-4654-aff9-047fb5a84134,qi run,Q kasih bintang 2 karena ketika aktifkan VPN ni Aplikasi Chat jadi ngk bisa.,2,2024-03-20 13:04:40
fb30bdba-18af-4fd4-8a76-d1a2b1af11ae,Radit mlyn,Aplikasinya bagus gak lag saat bermain game dan banyak negara yang bisa dipilihðŸ˜˜,1,2024-03-18 14:41:51
d490ded1-50ba-4b5a-9b4e-3decd98b29a5,As' ad Brother Channel,Kenapa tiba-tiba motong saldo padahal tidak berlangganan 187.500 itu bukan uang yang sedikit SUNGGUH APLIKASI MERUGIKAN Saya tidak terima jika saldo saya terpotong secara sepihak tanpa konfirmasi,1,2024-03-09 17:34:58
f7164cf3-1787-4f94-bd18-960f5c8c02fc,Ekin Putra lahang,"Untuk aplikasi nya sang at membatu saya beri â­5+, cuman mohon ikalanya di kondisi kan agar pengguna tidak kecewa jos",5,2024-02-01 23:03:21
1c78f3a4-2592-46e8-bde1-6f4834fe4921,Avarel the grungs Crazz,Kukira bagus tetapi malah memperburuk. Kecepatan berkurang dan internet menjadi lama... biar kan bintang satu saja karena apk ini jelek,1,2024-01-07 21:26:58
132ffe39-b69d-4204-aca7-f0c4b1c06bc2,Rian Putra,"Aplikasinya bagus banget, mudah di gunakan, gak ribet lumayan banyak server yang free mantap dah",5,2024-02-21 16:03:11
93c7d636-097c-456e-9ac5-e7761c726da0,Mr. Faisal1322 (Esal1322),Halo developer turbo.saya ingin tanya kenapa buat wifi gak bisa sambung tolong memang gak bisa atau gak bisa buat wifi wireless,3,2024-03-16 11:19:45
6e9fda84-5b72-401c-8186-2beaff29c280,Iqbal Ramdan,Bagus aplikasinya cuma klo bisa iklannya jangan memaksa untuk di klik karna sanga mengganggu trimakasih ðŸ™ðŸ‘,5,2024-02-15 22:39:32
efac418a-8922-4e2a-a252-23545e4b34f7,Bhyntank chavalera,Aplikasi yang bagus semua situs internet mudah terbuka dan lancar. Tapi kalau bisa di perlancar lagi jaringannya.,5,2024-01-07 00:06:30
58e3425d-be35-412d-bea3-93307d22acbc,Xxx Xxx,Sangat membantu . Jadi gampang setiap mau ngeluarin sesuatu tinggal buka aplikasi ini lalu nyari video,5,2024-03-04 11:09:24
8c50243c-590a-4130-88d5-8d1f68512d0d,Rio Candra,"Game apa ini, saya kasi bintang 5 biar di perbaiki ini gamenya... Kalo gamenya bagus kan pasti banyak peminatnya.",5,2024-02-15 01:56:15
502fea86-e5aa-4a8d-be63-63c0bc220a14,Bhy Ebing,Aplikasi turbo vpn in sangat baik situs yang kita cari cepat kita dapat di aplikasi in pokoknya sangat bagus,5,2024-01-06 04:42:09
4dad1cee-8caf-4596-82c6-070c2ecf5e45,Herlina Bregez,"Turbu VPN adlah aplikasi yg sangat bagus teman2,karena paling cepat dan juga aman buat situs yg kita cari skrg ini semuanya bisa kita lihat di Aplikasi Turbo VPN jgn pusing disini lengkap dan yg pastinya paling aman anti blokkkkkk....",5,2023-12-15 13:30:49
cc67a48b-24fa-4b6a-842e-99ccd3950b7f,T.Dedek Putra,Sangat sangat membantu dan sangat sangat the Best..bagus untuk smua hal dalam hal lain .pemecah masalah besar..Jos,5,2024-02-03 12:10:15
04a24240-a86c-4c8e-85b8-e04f44c0212e,Pindang Ebi,"Turbo VPN cakep banget gan bisa membantu saya dlm berselancar di Internet dunia, soal iklan Udah biasa,",4,2024-03-11 20:29:34
c332dba6-5fb8-4f3d-b0ff-40851318bdf4,Hisyam Asyabani,Sejauh ini masih fine2 aj..sq sangat enjoy mnggunkn apliksi ini..tapi durasi hanya skitar 3 jam..stlh itu lelet..gk tau ap pnybbnya..,5,2024-03-01 22:33:21
76b3c4ef-fb08-4ba0-a8bd-51c9ff49c333,Sunoo Jay,Sebenarnya bagus sih aplikasiny cuma kecepatannya aja yg kurang cepat mohon diperbaiki lagi,4,2024-03-15 17:25:38
aa7a741d-8837-4f87-b1d4-e9a082418fcd,Arjuna Mamba,Saya coba aplikasinya dulu utk kecepatan konektivitas jaringan yg mumpuni....,3,2024-03-02 12:08:51
8b4b0748-2bd3-42eb-b775-2f46888d5d65,Ahmad Heru,Mantap. Lebih tingkatkan lagi biar ip hp bisa disembunyikan dan gak kedeteksi,5,2024-02-24 07:16:44
7d050ba4-9e4e-4899-8fe2-7d095ac440c0,Hendar Jeni N,"Baik sekali d tempat pegunungan hp ga lemot, tingkatkan pelayanan supaya lebih ok ðŸ‘ðŸ‘ maaantaaap hebat",5,2024-02-26 21:34:12
7f5540e6-e863-4e07-b02d-a560bb1e50c6,Dedi Furnama,"Sangat bagus dan cepat,walaupun ada iklan tapi sangat membantu untuk yang gratisan",5,2024-03-04 10:26:04
4bddf866-166a-4438-bed8-c5940ad41fa9,agan triguna,bagus. sejauh ini aplikasi sangat membantu perjalanan pribadi saya cepat dan aman .,5,2024-03-03 16:32:29
95f80f06-a5a0-4f67-aa57-c517be566d64,Emil Oktrino,aplikasi sangat bagus.tapi harus ditingkatkan kecepatan nya.,5,2024-02-28 20:51:24
fb287a47-679f-401c-9984-9926e28d0d63,Andira Apriliana,Sedikit perbaikan masalah server koneksi buruk agar bisa stabil,4,2024-02-23 21:10:42
4a124589-0a10-4bcc-af1b-b21e8d0a08dd,Ary,"Vpn terparah, Dari awal sudah lemot sih, memang gratis tapi masa speed 15 bytes",1,2024-03-06 11:11:18
a8eca9a7-077a-4cd7-82ed-d9d207e69404,Desta Iannone,"Sering keluar sendiri,kadang putus,suruh ganti lokasi untuk memperbaiki masalah,",1,2024-03-03 02:13:16
a553b8a1-7f46-4b2a-88b8-0b8a998e7652,Yetro Amilono,terlalu banyak iklan dan suka putus2 sendiri tolong diperbaiki la,4,2024-03-04 23:42:24
326222e2-13c2-4be8-accf-e8ccc6d3b568,Rudi Indrawan,Cocok untuk nonton yutube dilatar belakang. Kaya buat gantiin yutub premium pas denger musik,5,2024-02-25 12:05:32
f6c7eff1-732a-482a-8897-9fa92830816a,Hanafi Mtp,"Vpnnya memang top dah.. Sesuai namanya, Turbo...",4,2024-03-04 04:08:24
a1dbbbec-6070-451e-a364-eaf2d03001ea,rizal Afrizam,Kecepatan internet nya di usahakan tetap stabil dalam kondisi cuaca apapun,5,2024-02-28 22:18:04
dd4fd78e-3977-4747-b9fc-5bf0f7c934b1,Hary Anggoman,Mantap....namun iklan jangan terlalu sering yaa,5,2024-02-26 22:59:44
3706b67f-cf98-4865-bfc5-60ce3df9111f,Hamnanot Nanot,"Saya sangat menyukai dgn adanya aplikasi turbo VPN ini, semua lancar dan semua terbukaðŸ‘ðŸ¼ðŸ‘ðŸ¼ðŸ‘ðŸ¼",5,2024-03-16 09:29:45
15a81b3b-7263-46b6-83b8-0f02d13cbbe4,Intan putri Sani,Saya kasih bintang lima karna aplikasi ini sangat membantu dalam pencarian apapun baik yg di dalam negeri maupun di luar negeri,5,2024-03-16 05:54:34
8aaf05e2-721d-42d6-b283-5c1395877fca,hermawan iwan,Pengalaman dan pembelajaran yg positivnya kita ambil utk diri sendiri.,5,2024-03-14 20:53:14
b556f864-4fcf-4b50-bb6d-518d14fb7d07,Rini Setia,Aplikasi babi ngrusak sinyal iklan nya non stop.. Lebih baik un instal,1,2024-02-25 22:31:58
16abad7a-1cb8-4fcb-9693-815747571a7a,rihan nahir,"aplikasi yaa bagus cuuy ,,!!gak lecet mudah dikontrol",5,2024-03-05 23:51:12
7847a16c-76c6-4587-96e4-092cb1c78863,Amanda Alycia,"bagus banget gilaa, sinyal lancar tanpa ngelag suka banget dehh",5,2024-03-02 11:18:18
be791a8c-488c-4e6e-b5fc-246be00a8294,Mumtaz Cell,Turbo VPN memang menyenangkan untuk menghilangkan stres.,5,2024-03-10 17:12:08
ddec4e59-b6e5-41a6-aa96-6968ef45d0ed,syandie damara,Terimakasih untuk kalian pembuat turbo VPN saya make apk kalian hanya untuk nobo :)) semoga sukses selalu ya,5,2024-03-10 01:28:37
b4c2f818-2047-4ff4-b92f-fc6cd8cd1fb7,Karna Almachzumi,"Sangat sangat sangat membantu buat membuat situs link streaming bola luar,best vvn",5,2024-02-01 08:04:28
1afea67e-26b1-453c-9c3b-8b2a26f2d383,Ira dewi Sahara,"Sangat membantu cuma kadang iklannya main nyrobot aja, selebihnya mantaapp ðŸ‘ðŸ‘",5,2024-03-14 19:30:58
23ede56f-cd9c-4d62-a706-0fdced074a66,Takia Hadi,Lumayan Cuma saran dari saya semoga ke depannya Bisa download apk,4,2024-03-20 02:44:20
a186228b-b1f4-4f6a-94d7-45b2b70bad6b,Junio Prtama,Aplikasi nya bagus si tapi terlalu bnyak iklan nya,5,2024-02-23 22:14:54
30ed82d3-bb8f-4146-887a-0c3ff65771c9,Selfanny Latuperissa,Mantap... Tapi kalo lagi lancar Suka mati sendiri tapi bagus ðŸŽ‰,5,2024-02-25 15:25:57
4f8209dc-1efa-4fa1-97e0-ca0ee858db37,Bagus Satria,"Sangat membantu sekali untuk bekerja dan mudah digunakan, semoga bisa lebih optimal dari sebelumnya",5,2024-02-16 20:58:10
59ff4674-6026-4e17-8d55-72c8593ff55e,Irham Mulyadi,Baru download tapi tapi ga koneksi trus padahal pake wifi aneh,3,2024-03-07 00:47:51
ef67e166-56e9-433c-85ad-c530dbe0d419,ex0 Suryono,"Cukup lumayan,,, klo bsa akses ke stabilan nya agak di tingkatkan lagi...ðŸ™",5,2024-01-20 11:56:55
ce6b1ccf-6b7d-42ce-ac4d-d4a7b73d7a08,ANDRILIA ALFARO,"Untuk saat ini sudah sangat bagus,, Dan kalau bisa tingkatkan lagi jaringan nya",5,2024-02-16 14:46:25
ac5e451e-20d3-470e-9d63-d7ac7491ce99,Zack Lee,Keren.. Emang terbaik turbo vpn ini.. Makasih atas aplikasinya yang sangat membantu..,5,2024-02-12 03:04:03
cae4d4cb-f20c-4dbd-b122-f5e78e30035b,Dicky Watirsondari,Aplikasi yang sngat membantu untuk mengunduh video... Sekali lagi kami ucapkan banyak terimaksih,5,2024-02-20 13:01:41
be1ac88b-3dae-44a7-9f50-66b5f058a76e,Taufik nasrulloh,"Kurang stabil dari segi jaringannya , mohon untuk diperbaiki lagi supaya kedepannya bisa lebih bagus lagi",4,2024-01-12 23:45:58
9f5adf50-9277-4766-a095-8eec619847c4,Mhaz Beer_Tho (Gembel elit),"Sangat membantu..intinya saya suka, mode free pun lncar, meski hrus bayar dgan nonton iklan",5,2024-01-20 20:23:54
adf007f2-3e21-4ffc-8754-648053c70b72,Endah Jayapura,saya pengguna VIP kecewa banged bertahan beberapa menit aja abis itu off lagi.. gimana ni kok gini amat sangat merugikan uda beli VIP mahalÂ² ðŸ˜,5,2024-01-11 10:46:11
f19c9f90-26be-4b48-8aee-533dbea48e77,CAH KERTOSONO (KHOLIS),Sangat membantu banget untuk melihat film drama sulit kebuka pakek apl turbo ini langsung bisa kebuka trimakasih turbo VPN,5,2024-02-23 06:47:19
82514cb2-770e-4fdb-934f-bd638a9aa8a0,Nardin Adin,Menurut saya aplikasi ini sangat bagus soal iklan tidak masalah untuk saya turbo VPN ni bos senggol dong,5,2024-01-12 21:06:42
3cd32225-ec13-48ab-b5c8-51fe85279006,Arab Nub,"Ini juga merupakan aplikasi jempolan untuk kaum adam yg punya gairah sex, tapi juga tidak bida kita napikan untuk orang yg panatik untuk mrngabaikan ini, saran buatlah konten yg sangat sangat menarik untuk sem kaum dg batasan umur yg ditetapkan supaya tidak menimbulkan masaalah di kemudian hari,",4,2024-01-17 22:10:13
35b830e1-82a7-46ed-b27b-caaf6df39aa4,Velvet Lembut,"Lumayanlah untuk vpn yang gratis, kalau mau yang cepat, ya harus yang berbayar.",4,2024-02-08 01:18:01
d74bb1e2-02b3-43d5-acda-aa98545ccef4,Aditya Armando,Oke lah buat vvn dari hampir lebih dri 20 gua dowload Ini yang terbaik.. Cuma kebanyakan iklan,5,2024-02-01 10:35:43
d4694c17-6fb4-461a-bd41-1c104904d68c,Syabil Jerman,Top banget suka vidio nya biasa nya ga pake aplikasi turbo bisa sekarang harus pake aplikasi turbo.....,5,2024-02-12 03:45:46
ddae8b1b-687b-4467-8cb2-28c6b50dcc67,Junaydie87@yahoo.com Junaydie,"apk ini sangat bagus dan membantu, cuman klu bisa iklan nya di kurangin",5,2024-01-17 23:47:40
0767ec72-cda0-429f-9bfe-7acd324ba522,Alkoni,"Sangat bagus.. Aku suka bangan ma apc ini.. Walupun ado sedik gangaun,saran aku iklanyo klw bisa di kurangin..",5,2024-02-15 10:17:24
0afcb04d-9ba4-43e7-a0d6-a5eb003c801c,Armansa Arman,"Aku kasih bintang full ajah soalnya aku baru download aplikasi ini tanksðŸ‘ðŸ‘mantap aplikasinya, aplikasi ini keren dan bisa membuka situs yang di blokir thanksðŸ‘",5,2024-02-06 16:56:39
8d91e539-bf10-43df-b744-d121aa997634,Ny Wahyu15,"Aplikasi nya bagus, sedikit terganggu dengan iklan nya yg agak lama bintang 4 aja",4,2024-01-11 19:32:06
cd53b0be-f468-4627-8f8d-522a434e632a,Heru Wiladeg,"Tambah cepat, mudah digunakan. ðŸ‘ Memang topmarkotop Makasih pengmbangðŸ‘Œ",5,2024-01-18 11:01:30
