reviewId,userName,content,score,at
76e331cf-29b5-4814-98fd-f450125d99cb,The Oddly Weird Girl,"The ads aren't that much of a hassle, and it provides a ton of countries even on the free version of the app which is great. However, my only issue is that it disconnects itself randomly at times? It does get kind of annoying to have to reconnect every time but overall it's pretty amazing already for being a mostly free service",4,2024-03-15 22:49:15
7848398b-f08b-461f-a1d8-592656f9da4e,Tazoar Ahmad,"I recently started using Turbo VPN, and I must say it has exceeded my expectations. The connection speed is impressive, providing seamless browsing and streaming without any lag. The user interface is intuitive and user-friendly, making it easy for anyone to navigate. Turbo VPN's server options are diverse, allowing me to access content from around the globe effortlessly. What sets it apart is its reliability â€“ I've experienced consistent and stable connectio",5,2024-01-21 22:01:30
eb6a6bcb-308b-406d-86d5-cd4340db11fc,Lee S,"I do not trust this developer. I signed up for the free trial but did not want to continue. The subscription auto stsrted and there is no easy way to cancel. Also, there are no servers in most countries. When I eventually contacted customer support, they say I have to go to Google Play to cancel. This is odd since I did not subscribe to begin with. I expect it should be just as easy to cancel. I feel cheated.",1,2024-02-15 11:00:52
b9249cd9-183c-4ece-8489-8712fe5cfaab,Jamie Beard,You advertised that this vpn works in russia 2024 the free version worked well but as soon as I paid for the full version it quit working in russia. Update: tried working with the customer service to fix the issue with no result. The funny part is the free version still works how messed up is it that the free version works and the paid version does not UPDATE: THE ISSUE HAS BEEN FIXED FOR NOW AFTER 6 COMPLAINTS TO THE COMPANY I WILL UPDATE IF IT WORKS FOR 30 DAYS IN A ROW,1,2024-03-20 23:04:06
1f58a994-499c-44ea-8756-773f2e925e4f,Sue,"This app is awesome and easy to use. Sure, there's ads, however, I don't think it's too much to ask to watch a couple short videos or have an ad pop up every once in a while for solid FREE internet privacy, especially in Canada where our PM is taking away all our privacy, and freedom of speech.. Turbo VPN is like giving the government a BIG F.U!",5,2024-03-02 12:32:02
e7ab2157-b358-4f63-a0ca-958809bc1dd6,April Midnight,It's an awesome app.. helps a lot. I've always wanted to watch a certain movie which only available in a specific country. Very happy with results ðŸ˜Š,5,2024-03-23 09:09:18
318b4f6a-6e46-4805-a6cb-24b06d5cfbb6,Dee Kaye,"Best VPN app I've used so far. It gives you easy options to pick a location, or manage your time. I also love the feature that lets you switch off VPN for apps you choose, which helps control lagging on your phone. Well done, folks.",5,2024-03-18 07:25:51
d59c7ce3-14fd-4a37-8ac7-c34bbd02e3d3,J. L. O,I used this a few years ago and it was pretty good. But not now...it sucks! Free trial? You should pay people to use it. It doesn't stay connected or connect it all. I'll keep shopping for a different VPN choice ty. BTW it only took me an hour to decide that I didn't want this and to cancel,1,2024-03-01 13:23:07
e05383f5-6911-45a5-a1c1-2d7d36b784dd,Jada Stephens-morningstar,"Very awesome app. So far has helped tremendously! User experience I can identify with. -jack woods _______________________________________ Thank you for responding so quickly Cindy! I think you should not change anything about the app. I love the way you are able to bounce around from location to location using the smart connection feature. Also, I really enjoy the FREE feature most of all! -jack woods",1,2024-03-23 13:50:17
63597e33-c389-4c65-8837-5389e91a40da,Michael Weddle,"Actually free! Please just watch the ads to support these devs. My God, I download 3 or 4 other ""free"" VPN apps before I found this one. Their ads aren't long. Their speeds are high enough to stream 1080p and play games. They deserve the support. No problems so far. Today was my first day.",5,2024-02-28 12:59:48
aa390869-0adb-49fb-b4a4-9536ddcb18b4,goodwill goodin,"Everything works fine but has gotten very slow lately, to the point it barely even load a single image. Glad I tested this in a few days till I got to see the downside of this before I decide to even buy its premium.",1,2024-02-23 20:44:08
a6dff3a6-ec43-4037-b8f9-4f21fdb833ed,Efe Bey,"Pretty solid VPN. Simple and easy to use, not much delay on the servers and it barely takes up space in the storage, if you appreciate simplicity then this app is very likely the most ideal VPN provider you'll find.",5,2024-03-06 05:17:08
95ff89eb-a497-4259-bc13-f2f16d09cf4d,usman razzaque,"Among all the vpn ,probably this one is the best there is, slightly more expensive but worth the money. I have tried couple of them and turbo vpn is the most user friendly albeit with annoying ads in free version ofcourse.",4,2024-02-27 07:44:53
21a96958-59c4-4436-8fb0-d35191b0dd60,Hamsul Basri,"I just tried a trial version, only worked for just couple of seconds and then i should reconnect again. That happened couple of time as if that's all my routine usibg this vpn app. So it is perfect for those whose time is worthless. Too doubt for premium subscription.",1,2024-02-11 16:00:32
e9bee098-1dbd-4fd9-88a9-e1c650fed251,Michael Rocks,"The reasoning behind me putting 4 stars is due to the fact of the ads, it's quite annoying and hard to deal with, other than that, it's a good app! Edit - I understand, some apps need ads to keep up and running, thank you for informing me!",5,2024-02-02 00:07:06
7ad048c6-a3f0-4520-9e2c-fcc95aea7a8d,Andrew Dressel,"Easy to use, honest app. Transparent with how the process works!! Easily accessable app developers/support- I definitely will say that the graphics and adds could definitely use a modern revision, a fresher look. Great prices and awesome discounts!!!",5,2024-01-28 09:17:58
68410107-ba8f-4e98-b1ac-3263a082ffa8,Shamraj Kidboy,I've been using Turbo vpn for my Editing purpose... But the way the connection and speed is good. But it sucks when It's comes at the point of Ads it contains High amount of adult contents... While connecting I won't shows any ads but while disconnecting I shows adult ads... Unexpected My parents saw it while they have my mobile for seeing my edited video!! Resolve this problem ASAP otherwise it should be in the bin..ðŸ˜Š,1,2024-02-17 18:24:03
622df88d-fcdb-41cc-a89f-43941528fdd4,Jamil Abdullah Durrani,"It's a good application, and keeps you informed about all happening around, and secure app for sharing views and contacts with friends and family around the world aswell as political issues of interests. Great facilities and quick responses of whatever is required. Thanks",4,2024-02-19 22:57:58
2946325a-6df8-4b14-a611-d864ac149d13,Matt B,"Would give 0 stars if possible. Pay for longest adds ever., then if u want more than 3 countries or high speed u must upgrade . Lol what a rip. Why double charge ? I.e. I needed a Japan server . So the basic package was useless . I've already Uninstalled and canceled. That was a dirty trick . Look at all our servers everywhere . So I paid . Then I find out to use all the servers i must pay again . And omg the adds are 60 seconds or more . No thanks cough ""proton vpn""",1,2024-02-05 20:16:01
2a2a9a89-fc32-4321-a861-f5aa6913dc1c,Subrata Sarkar,"High amount of ads. UPDATE: Service is not good anymore; speed is very slow, now it doesn't represent rabbitðŸ°, it's more like snail ðŸŒ. And, very unstable too, disconnects showing some errors, it's so frequent.",3,2024-02-16 14:06:03
3d13be74-d653-4ba1-801f-5e0d202f1dad,Alhuren Bereza,"Advertised as free on Google, definitely not free. Constantly pushed to upgrade to a higher tier service. Could not connect while using a local WiFi network, requiring me to use my cellphone data. Uninstalling and going back to Proton VPN.",1,2024-02-04 21:28:47
28323534-2f9c-43b1-94eb-85cda8755830,Viral Islamic Production (ViralislamicProduction),"Too much ads. For One time connect 3 ads and for disconnect again 3 ads. Total 6 ads running each time connect and disconnect. Ome ad is enough. You are getting live organic traffic on internet. So please stop showing ads or decrease, should be only one ad at connecting time. And for disconnecting should not any ad. Thank you",2,2024-03-15 20:46:42
24ed2813-453a-48bf-9190-7835af0ec1c7,Textingsynthesia,"This app is great, most vpns don't give you fast connections for free but this one does. If you are willing to put up with a few ads then this is probably the best you will get for not having to pay a dime.",5,2024-03-20 02:46:05
9da29947-c53f-4400-b81d-c385f93f9295,Alvino Ramadhan,"good apk, but please can the automatic disconnection be removed? I really hate it when you are busy playing with the browser and suddenly the connection is disconnected. I didn't even turn on power saving mode or anything.",3,2024-03-07 14:50:34
ea551568-1554-4632-a385-062bff42f859,Nithin George,"The App was working fine. But, recently an ad, which is annoyingly playing music in the background and can't be cancelled. It is interrupting the calling experience.",3,2024-01-29 11:00:35
5ac1c01e-ae81-4992-8418-fe335264a54a,Dave Truman,"It was the only VPN for Android that worked for me. Until I bought Premium subscription. After I bought it, it became same useless (connects maximum 3 times out of 10 when I need). I'm considering about deleting my paid account and use the free version with annoying ads. Looks like it worked better than the paid version. Very sad.",2,2023-11-09 19:55:08
62953d6f-3ff3-4de3-bae9-35db1afaefd4,Ù…ÙØ­ÙŽÙ…ÙŽÙ‘Ø¯Ù’ Ø¡ÙŽØ§ÙŽØ¯ÙÙ„,This VPN Takes some time to connect and sometimes it's speed becomes slow but not much slower also it has some bugs like when I go inside of the app to disconnect it shows an empty black screen for sometimes other than that it's ok,4,2024-02-16 10:48:31
4c723b00-385e-490e-a787-340a7514b25f,Shohjahon Toyirov,"As for me, the app works perfectly. It's true that it has a lot ads, but it doesn't change my opinion. I've been using this app for almost 1 year and for a year, it is working well. Sometimes (when I have problem with internet or in a some places that is strictly prohibited) it doesn't connect, but other times, it is perfect",5,2024-01-08 01:28:06
22c1bf10-7496-4a7a-9c41-a09f84012be8,Raimuli1717 Isbu,App is good to go. It gives you access to the platforms which are restricted. It gives a continuous connection to do your work uninterrupted...,5,2024-03-17 22:19:36
ced6d088-520c-49cc-9a44-46b25efacc6e,srikanth,"No working at all randomly dropping the connection to 0-0.1kbps keep disconnecting the internet, and if i reconnect, also initially, it show 12-14kbps and the with 10 seconds gradually downing to 0kbps no use of it",2,2024-02-24 20:02:51
8db4cd38-55dc-41c9-b0ff-aeacc91dfc20,Mohammed Ashik,"It's super secure, great for streaming, and has intuitive apps on a huge range of devices. It even includes an excellent password manager to keep everything secure.",5,2024-03-15 16:01:38
ac5fb064-092b-4238-a648-b6b23d3a091e,Fattuhaltaffalih,"Zedge server cannot be reached. Please try again shortly. it's always like that, I've tried several methods but there's still no change, please fix it, this has been happening for 5 months",2,2024-03-15 14:25:39
e58359b4-a55f-4edf-9468-143c9e1eccb5,A Google user,Look forward to going premium.. Str8 Forward App I like it Much However.. Been a week or two since upgrading.. Lagging & Seems to not like certain Sites which are Visited daily by the Masses.. ðŸ¤žQuick Fix.. ðŸ™‚,5,2024-03-15 02:18:05
b524cca0-10cf-4da2-b97d-650c0d34743a,Sajal Dagur,This app is nice but I found a bug is after two or three days later data is not connected to server try two or three but it is not connected to server but app is working good it is nice app where data working is slow so we start. the vpn app is working,5,2024-03-07 20:26:27
5d94c42f-72b0-4e50-b980-68182dc101c9,David Kam Kim,"This vpn wasn't bad at all,It just that it sometimes work very slow like when we download apps or videos.,downloading apps up-to 100mb took 1-2hours, so it took 1-2day to finish downloading video.",4,2024-03-21 17:55:58
be438454-2555-4c69-965d-5c9305e7593c,Raven,"Best VPN that you can get for free, yes the ads might be a bit annoying at times, but honestly I don't mind watching a 30 second as for the speed the app can provide. I support Turbo VPN",5,2024-02-22 22:36:45
1e182fe7-409b-4c8f-96a0-1642b15caadb,faisal khan,"It works fine but sometimes very slow, after purchasing it's premium plan am facing issues today cannot restore my account it's showing network exception everytime. And i don't know why and there is no suppot for that and turbo vpn is not working anymore.",2,2024-02-03 00:08:02
99575736-c460-4ba6-bf5c-6e4e443ad2e8,Kunti Rai,It is best app because it can change the reason of free fire ðŸ”¥ I don't thought that it can change my server but it will work first you have to connect the VPN and your work will done and then disconnect the VPN,5,2024-02-19 10:14:37
654bf259-641b-48b6-aa2f-7659df608d5c,Nick C,Decent VPN not worth the 35bux I paid for the year though. Constantly disconnecting and having to reopen the app and reselect the server. But it works. Wish I could get my money back,3,2024-02-29 10:30:28
cea07e52-72ac-49a9-b5b3-41e31a715ff4,Ewan Barry,"Ah, I see! All I'm saying is if there was a way to make give this an app a way to make a hotspot that includes the VPN. Because I use this in school and not everyone has access to the app but want the VPN. (:",4,2024-03-22 11:43:12
a6f06885-6a6a-41df-8442-fcea0b44b351,Ramesh Dhanoa,First I can connect all servers but now whenever I join and the app I use in that it show network connection error please fix it because if I use a server after that I cannot use that same server it shows an error,4,2024-03-18 00:29:55
7c20952e-5f1c-4f30-be99-363ff4fe1b05,Deanosaur,Split tunneling doesn't show all apps in alphabetical order! It's a real pain trying to find the apps I need to select ðŸ˜­,3,2024-03-22 17:31:08
ea007636-c0d2-4504-ba5a-d9a2341d4283,D. Hawkins,"Fast, and easily understandable...4Stars. A reliablity and security rating, would require further trial.",4,2024-03-23 05:27:42
c14204dc-b948-4f52-b66b-a1b3d2ae1d94,Antonio B,Hands down the best Bang for your buck. If you're going to subscribe to any VPN service. TURBO VPN I've never had a reason to even consider another.,5,2024-03-18 11:13:04
938c726f-b39a-4cbc-9427-d28b9968937b,Sharif Sircar,"Fair warning, obnoxious ad experience. Edit: I understand the reasoning behind the rapid fire ads, if it affects user experience to that extent, there really should be a warning and paid user should be on a seperate app.",3,2024-03-08 04:55:43
5fbe0ea2-a57d-4728-ba0d-15ead08c5bc6,eternal bliss,"Best free vpn app I've tried. Quick and easy to use. The ads are a bit aggressive but other than that, it does the basics quite well.",5,2024-02-24 18:34:20
fd69ef66-97ef-4634-a19a-4684bd63518d,Lily Pierce,it's okay for the most part but I get way too many adds and they are incredibly inappropriate and not something people should see.,2,2024-03-22 03:15:15
0b37a52a-c742-4496-abf2-5cafd9ff0390,bogdan ivkovic,"Hey, could you give an accurate description of what your update did, you p.o.s devs? Cause it definitely didn't optimize connection speeds. What it did do, is I have twice as many ads now than before. And the speeds have been crippled. Used to get 400kb/s on average. Now I'm lucky to even get above bytes of speed. Good job, m/o/r/o/n/s!",2,2023-11-30 04:34:23
16426163-f988-404a-bf85-1db0db0a41b3,Benoit Elias-Roberge,"Recent update adds music that plays constantly while the app is open, so if you want to use the VPN there will be music playing in the background",1,2024-01-21 04:47:27
5405332b-6045-4ae2-b166-aa10cf9f1526,Jim Jam,Have just moved to a different VPN as I used to effortlessly connect to all apps. Now it doesn't work on some had been paying subscription hence why its getting 3 star.,3,2024-02-23 15:18:07
f2e47a47-b4b5-49d3-9019-55d46267c09f,Jeffrey â€œDrBluesâ€ Daso,"Works well so far, but they're kinda pushy with annoying pop-up ads and trying to get you to rate them 5 stars before you are reasonably able to judge the app's performance enough to give an honest rating.",4,2024-02-21 17:46:35
1b787fbe-fc3a-4086-aeb1-d80e4659d806,Dale The Pikachu,"Everyone online is entitled to remain anonymous. The ads are a small price to pay. However sometimes I cant exit the ads even after watching them for several minutes, having to kill the process and restart it, sometimes quite a lot. But in the end I'm happy with it. EDIT AFTER RESPONSE: Thanks for replying to me ^~^ *hugs and lowers meh ears* I'm not being rude but you forgot the message that the ads are not closing unless I kill the CPU process manually, bug? I adore your app, a free vpn.",4,2023-10-18 09:22:23
6034d726-3fe8-43f3-a4cd-cadd27516dc6,Lax Eveloper,"I have been using this app for a long time. Earlier it had a slow speed, but now it is much improved and I like it. The speed it good and the UI is simple. One of the best VPNs in free category.",5,2024-01-24 20:01:36
b56b4f11-5d3e-4fff-a2b9-62ad7b9ce4fb,Herilanto Tsitohaina Rasamoelina Andriamanantsoa,"I'm not against ads but in this app, ads appear on critical moment, and are unskippable, after 1h of a war with ads, i uninstalled",1,2024-03-21 20:04:08
8cace60f-d3ab-4484-909e-075060c98132,Christian BeroÃ±a,"This worked exceptionally well before but all of a sudden does not connect and always says ""Busy try again"" or something like that, and before you tell me to clear cache already did",1,2024-03-11 12:11:01
b55d8372-238d-4665-aa4e-bc36e45d9023,Kriti Raj,"I found that this is a very usefull app. Also try to download Google Gemini Apk, but due to security reasons it only launch in usa now. But you can try Gemni apk in your mobile phone and desktops with the help of turbo VPN. This is really amazing experience for all AI Tools users.",5,2024-02-10 18:50:32
1b09ce59-32e8-4154-b039-363e96fc285c,merlin mage,Used to work on this website but not anymore i tried others same deal they detect the vpn and cant bypass region block. Yea i tried all protocols theyre not working always worked flawlessly before.,2,2024-02-27 08:46:58
7ddfc7fc-da15-4b5e-a065-e5e01048cea9,Khushal Ingle,This is Vpn very good using for the cab cut editing software and but but 6 and 7 p.m. VPN do not connecting on my mobile but is is Vpn very good,2,2024-03-20 20:52:32
b465e51f-467d-45a6-9e4e-91e365c2c9ce,Jesse,"Hello Turbo developers this is for you: I keep getting asked to give 5 stars. I've always given this app 5 stars 3 times. Please. Stop. Oh, and guys, all you Google-nauts out there, try to acquire the yearly subscription, because it's really worth it.",5,2024-01-11 04:00:17
3f5e2214-9c20-429c-89be-e1c23a7ecac3,Robert â€œHANDSOME WARRIORâ€ Padilla,"Iv been using TURBO VPN for about a week now, trying out the free premium trial. I have never used a VPN before but for the first time, I needed to get into a site that was literally blocked by the USA Government. So I researched and narrowed it down to 3 and I downloaded this one first. I am extremely happy with this app. It has done everything it says it does. I will be buying a plan after the trial period and keeping this app for awhile.",5,2023-12-27 15:32:02
56512c5a-9c41-432a-9fd5-7644b708956d,Kevin Younger,"Works great! Since it's free with some ads, I have only had 1 add every time I open the app and 1 app when I go to refresh my VPN location. Keep up the great work. Plus you have the opption to upgrade to premium which I am considering. Have a great day.",5,2024-01-04 23:39:26
7923cc79-89e6-4187-9001-1f098edbd8ee,Sudeva Kiran,"It's good one. After few days not working properly, again I had to install it then started working properly. Let's see how long it works till, I'll come again to update my remarks later on.",4,2024-01-23 00:42:22
347be924-4fd5-49cc-b99c-b435fbe9ec95,N H,Looks good so far. Why cant it automatically find the fastest server itself?? I keep getting a notification to click buttons to fjnd the faster server! Grr,4,2024-03-20 14:25:34
1b5bba2d-2509-4e4a-ba9a-156237a3f468,Alex Ry,No connection at all. Now became completely trash app. 10 times to connect and the still fail? Why? Good thing I did cancel my paid version,1,2024-03-20 02:06:24
70a72273-4d40-41f6-9679-e33083c10cc6,Nikhil Jagtap,I'm Using this App From Last 3 Years.. But from Last 10 Days it Not Working Properly & Smoothly Videos Take Too Much Time Run.. Connection Disconnect in Midway/Very Soon. I'm Very Much Disappointed..,2,2024-03-09 12:43:37
58f68b8e-e803-4bb8-bd7f-b95efbacdde0,Ali Seyedabadi,Excellent performance on Wi-Fi connections but almost poor on mobile data. Keep up the good work.,5,2024-02-28 06:17:46
d8e32e3c-ba03-4a2c-aae2-2b3221475604,Cesar Junior,"Amazing AppðŸ‘ðŸ˜ðŸ˜˜ðŸ˜†ðŸ˜‚ðŸ¤£ðŸ˜Keep the good work. The very useful tool / App today. Help me a lot with my stuff or app or working things. Thankyou for being exist and continue developing the app. You're the man Devs. ðŸ™‡ðŸ˜‚ðŸ˜„ðŸ¤£ðŸ˜†ðŸ™‡ðŸ™ðŸ‘ðŸ˜ðŸ˜ Keep the good work. Oh and if there is something to say for improvement is speed connection and data security and connection security. So it won't be open/ breached easily, on the other hand, it all save and clear. That's all from me, thankyou & have a nice day. ðŸ˜",5,2024-01-27 13:04:05
f05126f0-9e38-40e3-97a6-1ed34fb1f964,Jason Song,Can anyone really connect to a server use this? I have a couple of VPN apps and this is the only one that I can't seem to get connected most of the time. How come it has 4.6 stars?,1,2024-03-14 18:18:38
4d257809-9f5c-4835-a3dc-f1f8992c1f32,Maryam Arain,It's a good app. I'm happyðŸ˜Š with this app. it's use very easy and helpful . I'm downloaded many videos and moviesðŸŽ¥. It's provided good connection . One is the best thing in this app it's free ðŸŽ‰ðŸ¥³.,5,2024-02-23 21:16:13
6a71da96-b499-437e-a9c3-5634508b1a27,Aztec,Better then nord vpn etc so far. Payed for premium very happy. Edit. Subscription shows ends in June but its asking me to renew now and won't connect,1,2024-02-27 23:11:33
0f07bac9-267f-4d20-9211-8327df0d7309,Braydon Hughes,Good speeds and free version ads are not a deal breaker. Premium option pricing is fair.,5,2024-03-02 23:07:00
365fc92f-34c4-49f6-90ed-1cef3d1428cc,Minal Gupta,Quick and seamless. Usually other vpn get disconnected inbetween but turbo VPN is always connected and gets the work done.,5,2024-03-03 12:15:08
d721cc86-5ac8-4ebc-9c15-3d9cf1cb2f4c,Thunder Foot,Doesn't stay connected for more than 5mins at a time. Have to restart app every time. And then be forced to watch another advert....,1,2024-02-26 13:02:16
2e33553f-16d9-472f-a6cb-ebc6f3d88546,Antoine,"Very bad vpn and the customer service doesn't help you to solve the connection issues, they keep repeating the same steps over and over again",1,2024-03-16 02:39:52
76a5ce48-f504-4ea9-8c53-4647e3e4eb22,Joshi,Excellent experience. You can also choose your preferred location. Great...must try high speed...,5,2024-03-05 02:12:25
66369bbe-b7cb-451d-8771-312b8cae6f39,Imli J,It sucked at first. But from the second week its showing really good performance. Keep up the good work.,5,2024-03-17 12:19:10
46658f8e-1f3d-4822-b99b-3d32c58440c7,Dp Rockzzz,Excellent App designed to use very normally and easy to open and works faster in many multiple nrletworking servers...highly rated and amazing ... so user friendly VPN..NO MONEY NEEDED,5,2024-03-14 16:40:53
63266f5e-48aa-4a07-a147-e8154ff67a9a,Jose Hernandez,"One of the top vpns out there being also one of the oldest. Stable, and fast even for bring free. Thanks turbo VPN!",5,2024-03-11 05:34:46
3d3973a6-722f-41c0-99da-aef781389ac2,Dewi Rama,"Sometimes the connection is super fast, sometimes not.. In my place, if you wanna use it then go at morning until late noon",5,2024-03-19 16:51:06
a79fb6c2-0878-4cdc-863a-3b415178e0da,Dario Cubrilo,"Absolute trash. Low life tricks. Aggressive advertising. Please geve me more ads ! Although I paid for ""Premium"" You are the best. You wanted your review so bad... here you go.",1,2024-02-28 07:27:23
b6d774c7-7e6a-4819-bc44-9dc0a3820970,Naman Singh,"I appreciate Turbo VPN's commitment to user privacy by collecting only anonymous data, ensuring a secure and private browsing experience. The transparency in logging practices reflects the app makers' dedication to maintaining user trust while delivering reliable VPN services. Thus, I am giving 5 stars you deserve it !",5,2024-03-06 19:45:34
7027533d-580a-4ef8-8946-123beca05be7,Maurice van der Meulen,Thanks for inviting me to the extra speed server. Best VPN with 7 days free trial I've had in a long time.,5,2024-03-16 20:11:15
e2459fe7-bc1a-4751-b171-1b9592f5bc8d,Grass Icecream,it's works ok for now but it does disconnect me alot and says something is wrong call customer service but restart the app and it will work fine for a bit IDK!! it is what it is I guess !!!,5,2024-01-07 17:20:22
489d37b2-4834-49a1-a710-c83f11f41948,Devayani Devayani,It was awesome! The downloading get faster as i wish. Solved download stuckking problems and it is easy to use.,5,2024-03-05 22:04:22
46a8a040-97ad-4831-98be-c3ced0e64d38,Murugamoorthy Paranthagan,"Great ðŸ‘, Free version working well but advertisement is there's because They need income to maintain,,,,, I suggest to all to enjoy ðŸ˜‰",5,2024-03-18 10:45:37
